{
  "snapshot_version": 1,
  "content_digest": "sha256:8546efbbe0f643b9f22a4e2de3767408d55a2c5d6f0d7b0a8ca31803a4409305",
  "country_snapshot_version": 1,
  "provenance": {
    "sources": [
      {
        "role": "identity",
        "name": "ISO 4217 List One (sintético)",
        "edition": "synthetic-1",
        "retrieved_at": "2026-11-01",
        "location": "tests/fixtures (sintético, no productivo)",
        "checksum": "sha256:0000000000000000000000000000000000000000000000000000000000000000",
        "license": "CC0-1.0 (fixture sintético)"
      },
      {
        "role": "names",
        "name": "CLDR (sintético)",
        "edition": "synthetic-1",
        "retrieved_at": "2026-11-01",
        "location": "tests/fixtures (sintético, no productivo)",
        "checksum": "sha256:0000000000000000000000000000000000000000000000000000000000000000",
        "license": "CC0-1.0 (fixture sintético)"
      },
      {
        "role": "country_currency",
        "name": "ISO 4217 entidades (sintético)",
        "edition": "synthetic-1",
        "retrieved_at": "2026-11-01",
        "location": "tests/fixtures (sintético, no productivo)",
        "checksum": "sha256:0000000000000000000000000000000000000000000000000000000000000000",
        "license": "CC0-1.0 (fixture sintético)"
      },
      {
        "role": "validity",
        "name": "CLDR territorio-moneda (sintético)",
        "edition": "synthetic-1",
        "retrieved_at": "2026-11-01",
        "location": "tests/fixtures (sintético, no productivo)",
        "checksum": "sha256:0000000000000000000000000000000000000000000000000000000000000000",
        "license": "CC0-1.0 (fixture sintético)"
      }
    ],
    "unresolved_conflicts": []
  },
  "currencies": [
    {
      "currency_id": "499f86b1-0b36-594d-8536-95435b38eef1",
      "alphabetic_code": "ARS",
      "numeric_code": "032",
      "minor_units": 2,
      "fund_code": false,
      "status": "active",
      "replacement_currency_ids": []
    },
    {
      "currency_id": "12c3be84-c22e-5d01-adbf-f28c3aeb0807",
      "alphabetic_code": "USD",
      "numeric_code": "840",
      "minor_units": 2,
      "fund_code": false,
      "status": "active",
      "replacement_currency_ids": []
    },
    {
      "currency_id": "d18b9f80-2216-5eaa-a31a-dcf378ac0798",
      "alphabetic_code": "EUR",
      "numeric_code": "978",
      "minor_units": 2,
      "fund_code": false,
      "status": "active",
      "replacement_currency_ids": []
    },
    {
      "currency_id": "817ab824-0737-5fbb-b7c6-2752d247d2ee",
      "alphabetic_code": "PAB",
      "numeric_code": "590",
      "minor_units": 2,
      "fund_code": false,
      "status": "active",
      "replacement_currency_ids": []
    },
    {
      "currency_id": "e6348816-740e-5a74-a4a6-838e6ba003b8",
      "alphabetic_code": "JPY",
      "numeric_code": "392",
      "minor_units": 0,
      "fund_code": false,
      "status": "active",
      "replacement_currency_ids": []
    },
    {
      "currency_id": "c0ab10db-714c-56fb-921a-1270c025835d",
      "alphabetic_code": "KWD",
      "numeric_code": "414",
      "minor_units": 3,
      "fund_code": false,
      "status": "active",
      "replacement_currency_ids": []
    },
    {
      "currency_id": "cfa0ae34-bee4-5c1c-bfba-0c76dc41cac4",
      "alphabetic_code": "CLF",
      "numeric_code": "990",
      "minor_units": 4,
      "fund_code": true,
      "status": "active",
      "replacement_currency_ids": []
    },
    {
      "currency_id": "e19de4c9-122f-5978-8146-3be569e15bc1",
      "alphabetic_code": "XAU",
      "numeric_code": "959",
      "minor_units": null,
      "fund_code": false,
      "status": "active",
      "replacement_currency_ids": []
    },
    {
      "currency_id": "4daf85cc-a295-517b-b645-e201101bc009",
      "alphabetic_code": "XDR",
      "numeric_code": "960",
      "minor_units": null,
      "fund_code": false,
      "status": "active",
      "replacement_currency_ids": []
    },
    {
      "currency_id": "0f1efe82-eda9-5f18-9a01-42c1c2840309",
      "alphabetic_code": "BOB",
      "numeric_code": "068",
      "minor_units": 2,
      "fund_code": false,
      "status": "active",
      "replacement_currency_ids": []
    },
    {
      "currency_id": "d27a3fa6-65da-57fc-838a-16e0f10b4021",
      "alphabetic_code": "BOV",
      "numeric_code": "984",
      "minor_units": 2,
      "fund_code": true,
      "status": "active",
      "replacement_currency_ids": []
    },
    {
      "currency_id": "359df0bc-679f-54c7-8d2a-15126fe2dd15",
      "alphabetic_code": "CHF",
      "numeric_code": "756",
      "minor_units": 2,
      "fund_code": false,
      "status": "active",
      "replacement_currency_ids": []
    },
    {
      "currency_id": "c5be3dfa-27e9-5f49-9d6f-279a14f93756",
      "alphabetic_code": "CHE",
      "numeric_code": "947",
      "minor_units": 2,
      "fund_code": true,
      "status": "active",
      "replacement_currency_ids": []
    },
    {
      "currency_id": "1de4c96f-9e12-57c5-9fe4-91e988f1fc9a",
      "alphabetic_code": "CHW",
      "numeric_code": "948",
      "minor_units": 2,
      "fund_code": true,
      "status": "active",
      "replacement_currency_ids": []
    },
    {
      "currency_id": "5e30a2b9-8f2a-54fe-970b-ba49a3a17d94",
      "alphabetic_code": "HRK",
      "numeric_code": "191",
      "minor_units": 2,
      "fund_code": false,
      "status": "active",
      "replacement_currency_ids": []
    }
  ],
  "currency_names": [
    {
      "currency_id": "499f86b1-0b36-594d-8536-95435b38eef1",
      "locale_id": "1d806402-a823-4580-9f4d-958c6e5a5354",
      "name": "Argentine Peso"
    },
    {
      "currency_id": "499f86b1-0b36-594d-8536-95435b38eef1",
      "locale_id": "7d74e7f4-4dd7-4a85-a540-09d2393b9a91",
      "name": "peso argentino"
    },
    {
      "currency_id": "12c3be84-c22e-5d01-adbf-f28c3aeb0807",
      "locale_id": "1d806402-a823-4580-9f4d-958c6e5a5354",
      "name": "US Dollar"
    },
    {
      "currency_id": "12c3be84-c22e-5d01-adbf-f28c3aeb0807",
      "locale_id": "7d74e7f4-4dd7-4a85-a540-09d2393b9a91",
      "name": "dólar estadounidense"
    },
    {
      "currency_id": "d18b9f80-2216-5eaa-a31a-dcf378ac0798",
      "locale_id": "1d806402-a823-4580-9f4d-958c6e5a5354",
      "name": "Euro"
    },
    {
      "currency_id": "d18b9f80-2216-5eaa-a31a-dcf378ac0798",
      "locale_id": "7d74e7f4-4dd7-4a85-a540-09d2393b9a91",
      "name": "euro"
    },
    {
      "currency_id": "817ab824-0737-5fbb-b7c6-2752d247d2ee",
      "locale_id": "1d806402-a823-4580-9f4d-958c6e5a5354",
      "name": "Panamanian Balboa"
    },
    {
      "currency_id": "817ab824-0737-5fbb-b7c6-2752d247d2ee",
      "locale_id": "7d74e7f4-4dd7-4a85-a540-09d2393b9a91",
      "name": "balboa panameño"
    },
    {
      "currency_id": "e6348816-740e-5a74-a4a6-838e6ba003b8",
      "locale_id": "1d806402-a823-4580-9f4d-958c6e5a5354",
      "name": "Japanese Yen"
    },
    {
      "currency_id": "e6348816-740e-5a74-a4a6-838e6ba003b8",
      "locale_id": "7d74e7f4-4dd7-4a85-a540-09d2393b9a91",
      "name": "yen"
    },
    {
      "currency_id": "c0ab10db-714c-56fb-921a-1270c025835d",
      "locale_id": "1d806402-a823-4580-9f4d-958c6e5a5354",
      "name": "Kuwaiti Dinar"
    },
    {
      "currency_id": "c0ab10db-714c-56fb-921a-1270c025835d",
      "locale_id": "7d74e7f4-4dd7-4a85-a540-09d2393b9a91",
      "name": "dinar kuwaití"
    },
    {
      "currency_id": "cfa0ae34-bee4-5c1c-bfba-0c76dc41cac4",
      "locale_id": "1d806402-a823-4580-9f4d-958c6e5a5354",
      "name": "Unidad de Fomento"
    },
    {
      "currency_id": "cfa0ae34-bee4-5c1c-bfba-0c76dc41cac4",
      "locale_id": "7d74e7f4-4dd7-4a85-a540-09d2393b9a91",
      "name": "unidad de fomento"
    },
    {
      "currency_id": "e19de4c9-122f-5978-8146-3be569e15bc1",
      "locale_id": "1d806402-a823-4580-9f4d-958c6e5a5354",
      "name": "Gold"
    },
    {
      "currency_id": "e19de4c9-122f-5978-8146-3be569e15bc1",
      "locale_id": "7d74e7f4-4dd7-4a85-a540-09d2393b9a91",
      "name": "oro"
    },
    {
      "currency_id": "4daf85cc-a295-517b-b645-e201101bc009",
      "locale_id": "1d806402-a823-4580-9f4d-958c6e5a5354",
      "name": "SDR (Special Drawing Right)"
    },
    {
      "currency_id": "4daf85cc-a295-517b-b645-e201101bc009",
      "locale_id": "7d74e7f4-4dd7-4a85-a540-09d2393b9a91",
      "name": "derechos especiales de giro"
    },
    {
      "currency_id": "0f1efe82-eda9-5f18-9a01-42c1c2840309",
      "locale_id": "1d806402-a823-4580-9f4d-958c6e5a5354",
      "name": "Boliviano"
    },
    {
      "currency_id": "0f1efe82-eda9-5f18-9a01-42c1c2840309",
      "locale_id": "7d74e7f4-4dd7-4a85-a540-09d2393b9a91",
      "name": "boliviano"
    },
    {
      "currency_id": "d27a3fa6-65da-57fc-838a-16e0f10b4021",
      "locale_id": "1d806402-a823-4580-9f4d-958c6e5a5354",
      "name": "Bolivian Mvdol"
    },
    {
      "currency_id": "d27a3fa6-65da-57fc-838a-16e0f10b4021",
      "locale_id": "7d74e7f4-4dd7-4a85-a540-09d2393b9a91",
      "name": "mvdol boliviano"
    },
    {
      "currency_id": "359df0bc-679f-54c7-8d2a-15126fe2dd15",
      "locale_id": "1d806402-a823-4580-9f4d-958c6e5a5354",
      "name": "Swiss Franc"
    },
    {
      "currency_id": "359df0bc-679f-54c7-8d2a-15126fe2dd15",
      "locale_id": "7d74e7f4-4dd7-4a85-a540-09d2393b9a91",
      "name": "franco suizo"
    },
    {
      "currency_id": "c5be3dfa-27e9-5f49-9d6f-279a14f93756",
      "locale_id": "1d806402-a823-4580-9f4d-958c6e5a5354",
      "name": "WIR Euro"
    },
    {
      "currency_id": "c5be3dfa-27e9-5f49-9d6f-279a14f93756",
      "locale_id": "7d74e7f4-4dd7-4a85-a540-09d2393b9a91",
      "name": "euro WIR"
    },
    {
      "currency_id": "1de4c96f-9e12-57c5-9fe4-91e988f1fc9a",
      "locale_id": "1d806402-a823-4580-9f4d-958c6e5a5354",
      "name": "WIR Franc"
    },
    {
      "currency_id": "1de4c96f-9e12-57c5-9fe4-91e988f1fc9a",
      "locale_id": "7d74e7f4-4dd7-4a85-a540-09d2393b9a91",